"id";"city";"country";"region";"short_description";"latitude";"longitude";"budget_level";"culture";"adventure";"nature";"beaches";"nightlife";"cuisine";"wellness";"urban";"remoteness";"creative_city_category";"creative_city_year";"unesco_wh_count";"unesco_wh_names"
"c2f88913-cb3d-480a-9468-539f31cda9f7";"Osaka";"Japan";"asia";"Bustling streets filled with neon lights, delicious street food aromas, and the energetic hum of friendly locals create a lively urban vibe.";"34693756";"135501453";"Luxury";"4";"2";"3";"2";"4";"5";"3";"5";"2";"None";"0";"3";"Buddhist Monuments in the Horyu-ji Area | Historic Monuments of Ancient Nara | Mozu-Furuichi Kofun Group: Mounded Tombs of Ancient Japan"
"89a63e37-123a-4dfd-88d2-b7cb58c7b4e4";"Banjul";"Gambia";"africa";"Bustling markets filled with vibrant colors and the aroma of spices, alongside tranquil river views, create a welcoming and lively atmosphere.";"13441016";"-16562750";"Budget";"3";"3";"4";"4";"2";"3";"2";"2";"3";"None";"0";"2";"Kunta Kinteh Island and Related Sites | Saloum Delta"
"bbbaa3f2-5a06-4e14-9626-0ec02a43b129";"Hamburg";"Germany";"europe";"A lively port city where historic architecture meets modern design, offering a relaxed vibe with waterfront strolls and bustling markets.";"53550341";"10000654";"Mid-range";"4";"3";"3";"2";"4";"4";"3";"5";"2";"None";"0";"1";"Speicherstadt and Kontorhaus District with Chilehaus"
"8487babf-ddba-48fa-aaa9-d8bbf60b7d73";"Vilnius";"Lithuania";"europe";"Charming cobblestone streets and baroque architecture blend with a youthful energy, offering a cozy yet vibrant atmosphere perfect for leisurely exploration.";"54687045";"25282911";"Budget";"4";"2";"3";"2";"3";"3";"3";"3";"3";"Literature";"2021";"2";"Vilnius Historic Centre | Kernavė Archaeological Site (Cultural Reserve of Kernavė)"
"6cad25d4-a467-4942-9b04-0ace1de123e4";"San Cristobal";"Venezuela";"south_america";"A lively blend of bustling markets, friendly locals, and the refreshing mountain air creates a welcoming and invigorating atmosphere.";"7775666";"-72221415";"Budget";"3";"3";"4";"1";"3";"3";"3";"3";"4";"None";"0";"0";"None"
"3c17a4a0-29e4-4aba-aaba-8f6e831349f1";"Lübeck";"Germany";"europe";"Charming cobblestone streets lined with medieval architecture and the scent of marzipan create an inviting and cozy atmosphere for exploration.";"53866444";"10684738";"Mid-range";"4";"2";"3";"2";"3";"4";"3";"3";"3";"None";"0";"1";"Hanseatic City of Lübeck"
"c929605b-29fe-440d-9b79-c0a899e95238";"Antigua";"Guatemala";"north_america";"Cobblestone streets lined with colorful colonial buildings and vibrant markets create an enchanting atmosphere that feels both historic and warmly inviting.";"14556781";"-90733734";"Budget";"5";"3";"4";"1";"3";"4";"3";"3";"4";"None";"0";"1";"Antigua Guatemala"
"fd6dcc88-7ef3-4990-a6e2-ae24b08badab";"Akureyri";"Iceland";"europe";"Nestled by stunning fjords, this charming town offers a cozy vibe with colorful houses and a backdrop of snow-capped mountains.";"65683903";"-18112175";"Luxury";"3";"4";"5";"2";"2";"3";"3";"3";"4";"None";"0";"0";"None"
"279f4b89-4f47-45b5-bd14-a791517bdf37";"Varanasi";"India";"asia";"Winding alleyways filled with the scent of incense and the sound of temple bells create a spiritual and vibrant atmosphere by the river.";"25335649";"83007629";"Budget";"5";"2";"3";"1";"2";"4";"3";"3";"2";"Music";"2015";"0";"None"
"37d8bd6e-fad0-4304-93bd-26975ac8944f";"Ajaccio";"France";"europe";"Nestled between mountains and sea, this charming coastal town offers sunlit streets, vibrant markets, and a rich tapestry of history and culture.";"41926399";"8737602";"Mid-range";"4";"3";"4";"4";"3";"4";"3";"3";"4";"None";"0";"1";"Gulf of Porto: Calanche of Piana, Gulf of Girolata, Scandola Reserve"
"077a909f-9984-4cef-8872-07c697cab0fb";"Tanna Island";"Vanuatu";"oceania";"Lush jungles, volcanic landscapes, and welcoming locals create a serene and adventurous atmosphere, inviting you to explore and unwind.";"-19485778";"169334501";"Mid-range";"4";"4";"5";"4";"1";"3";"3";"1";"5";"None";"0";"0";"None"
"b3d93e9e-ad99-4429-b281-c0750bf6e2c8";"Ho Chi Minh City";"Vietnam";"asia";"Bustling streets filled with the aroma of street food and the hum of scooters create a vibrant, energetic atmosphere that's uniquely captivating.";"10776389";"106701139";"Budget";"4";"3";"2";"2";"4";"5";"3";"5";"2";"Film";"2025";"0";"None"
"bebdecac-357c-4178-a4d3-b29d1c286f0d";"York";"United Kingdom";"europe";"Charming cobblestone streets and ancient city walls create a cozy, inviting atmosphere, where history and modern vibrancy coexist beautifully.";"53965657";"-1074305";"Mid-range";"5";"2";"3";"1";"3";"4";"3";"3";"3";"Media Arts";"2014";"2";"Studley Royal Park including the Ruins of Fountains Abbey | Saltaire"
"49075331-5017-45a7-8645-0c668b2fe1bb";"Delhi";"India";"asia";"Bustling streets filled with vibrant colors, diverse aromas, and the sounds of life create an energetic and unforgettable experience.";"28627392";"77171695";"Budget";"5";"3";"2";"1";"4";"5";"3";"5";"1";"None";"0";"3";"Red Fort Complex | Humayun's Tomb, Delhi | Qutb Minar and its Monuments, Delhi"
"19ad6eea-d5b7-4468-8ed3-79e4c795bb7a";"Matera";"Italy";"europe";"Winding stone streets and ancient cave dwellings create an atmosphere of timeless mystery, inviting you to explore its unique history and charm.";"40447641";"16473573";"Mid-range";"5";"2";"3";"1";"2";"4";"3";"3";"4";"None";"0";"1";"The Sassi and the Park of the Rupestrian Churches of Matera"
"3cbd302a-6109-43c9-a113-112542bef4ae";"Hiroshima";"Japan";"asia";"A serene blend of reflective history and modern vibrancy, where tranquil gardens meet bustling streets, offering a deeply moving yet uplifting experience.";"34391724";"132451758";"Mid-range";"5";"2";"3";"2";"3";"4";"3";"3";"3";"None";"0";"2";"Hiroshima Peace Memorial (Genbaku Dome) | Itsukushima Shinto Shrine"
"0f7e00d1-189f-4504-a23d-71dc70d98ae4";"Vientiane";"Laos";"asia";"Tranquil streets lined with French colonial architecture, vibrant markets, and serene temples create a peaceful yet culturally rich experience.";"17964098";"102613370";"Budget";"4";"3";"3";"1";"2";"4";"3";"2";"4";"None";"0";"1";"Phu Phrabat, a testimony to the Sīma stone tradition of the Dvaravati period"
"25da92b8-f1f0-4a49-b8ee-45fbc0f1f17a";"Edinburgh";"United Kingdom";"europe";"Charming cobblestone streets, historic castles, and the sound of bagpipes create a magical atmosphere that feels both ancient and alive.";"55953345";"-3188374";"Mid-range";"5";"3";"3";"2";"4";"4";"3";"4";"2";"Literature";"2004";"2";"Old and New Towns of Edinburgh | The Forth Bridge"
"7e080529-0ecf-4c7a-b6dd-c316c5cfdab7";"Lusaka";"Zambia";"africa";"Bustling markets, vibrant local culture, and open green spaces create a lively yet laid-back atmosphere that's both welcoming and engaging.";"-15416339";"28281841";"Budget";"3";"3";"4";"1";"2";"3";"2";"3";"3";"None";"0";"0";"None"
"6018cfaa-2009-46c1-9b4e-abc97eecad6b";"Marrakesh";"Morocco";"africa";"A sensory feast of vibrant colors, aromatic spices, bustling souks, and serene gardens, creating an enchanting and immersive experience for every visitor.";"31625825";"-7989160";"Budget";"5";"3";"3";"1";"4";"5";"4";"4";"2";"None";"0";"1";"Medina of Marrakesh"
"01db5747-b1a8-4398-851b-5f4be4f7e453";"Palawan";"Philippines";"asia";"Crystal-clear waters, lush green landscapes, and vibrant marine life create a serene escape where relaxation and adventure blend seamlessly.";"11079897";"120937342";"Budget";"3";"4";"5";"5";"2";"3";"3";"2";"5";"None";"0";"0";"None"
"b5a1cb1c-42d2-4235-a907-6791f1177f34";"Ohrid";"North Macedonia";"europe";"Charming lakeside views, ancient cobblestone streets, and the scent of fresh coffee create a peaceful yet vibrant atmosphere perfect for unwinding.";"41117020";"20801771";"Budget";"4";"3";"5";"3";"3";"3";"3";"2";"4";"None";"0";"1";"Natural and Cultural Heritage of the Ohrid region"
"d61c9838-c92c-4619-aa92-5daf546b71df";"Algarve";"Portugal";"europe";"Golden cliffs and serene beaches meet charming villages, where the scent of grilled sardines and the sound of ocean waves fill the air.";"37244808";"-8150756";"Mid-range";"3";"4";"4";"5";"3";"4";"4";"3";"3";"None";"0";"0";"None"
"cd74974b-0218-4e6a-b947-13d8ee80dbb7";"Bucharest";"Romania";"europe";"Tree-lined boulevards, eclectic architecture, and lively squares invite you to explore a city where history and modernity coexist seamlessly.";"44436141";"26102720";"Budget";"4";"2";"3";"1";"4";"4";"3";"4";"2";"None";"0";"0";"None"
"5de00cf4-d669-44be-936b-707e01d25311";"Seychelles";"Seychelles";"africa";"Imagine pristine beaches with powdery sand, lush greenery, and the gentle sound of waves, offering a serene and rejuvenating escape.";"-4657497";"55454014";"Luxury";"2";"3";"5";"5";"2";"4";"4";"2";"5";"None";"0";"0";"None"
"c17afe66-e784-4b36-96ff-da56a56ff78a";"Zurich";"Switzerland";"europe";"Charming streets lined with elegant boutiques and cozy cafes offer a blend of modern sophistication and rich historical charm.";"47374448";"8541042";"Luxury";"4";"3";"4";"1";"3";"4";"4";"5";"2";"None";"0";"1";"Prehistoric Pile Dwellings around the Alps"
"5c470d58-5ad9-4aaa-903b-fa9a2bed3c68";"Dubai";"United Arab Emirates";"middle_east";"Skyscrapers glisten under the sun, luxury blends with tradition, and the aroma of spices fills the air, creating a uniquely vibrant experience.";"25074282";"55188538";"Luxury";"4";"4";"2";"4";"5";"4";"5";"5";"2";"Design";"2017";"0";"None"
"89e1f300-6ffd-4c18-a700-c9815dcdad84";"Zanzibar";"Tanzania";"africa";"White sandy beaches, turquoise waters, and the scent of spices fill the air, creating an enchanting and laid-back island vibe.";"-6166490";"39207431";"Mid-range";"4";"4";"5";"5";"3";"4";"4";"2";"4";"None";"0";"0";"None"
"60a84e59-6313-4576-a15a-b72c3e0dba67";"Atlanta";"United States";"north_america";"Bustling streets lined with lush trees, vibrant arts scenes, and a welcoming Southern charm create a warm and dynamic urban experience.";"33748992";"-84390264";"Mid-range";"4";"3";"3";"1";"4";"4";"3";"4";"2";"None";"0";"0";"None"
"40167255-1cae-4156-8d8d-cde07255405e";"Thimphu";"Bhutan";"asia";"Nestled in the mountains, this city blends serene monasteries with colorful markets, offering a unique blend of tradition and tranquility.";"27471354";"89633672";"Luxury";"5";"3";"4";"1";"2";"3";"4";"2";"5";"None";"0";"0";"None"
"0a7d0b01-4cdf-4968-81ea-ac4e5d5d2fa1";"Los Angeles";"United States";"north_america";"Endless sunshine, diverse neighborhoods, and the allure of Hollywood create a dynamic atmosphere where every street feels like a new adventure.";"34053690";"-118242766";"Luxury";"4";"3";"3";"4";"5";"4";"4";"5";"2";"None";"0";"0";"None"
"4ed326e5-e344-48c0-a1ff-b69d6fdb9b7f";"Savannah";"United States";"north_america";"Cobblestone streets lined with moss-draped oaks create a charming, historic atmosphere, inviting leisurely strolls and a sense of Southern hospitality.";"32079007";"-81092133";"Mid-range";"4";"3";"3";"2";"3";"4";"3";"3";"3";"None";"0";"0";"None"
"f7d86453-1908-48d0-9b86-63c6a6b7c2ae";"Bukhara";"Uzbekistan";"asia";"Wandering through ancient streets, you'll feel the echoes of history in every corner, with vibrant markets and the scent of spices filling the air.";"39767552";"64423132";"Budget";"5";"2";"3";"1";"2";"3";"2";"3";"4";"Crafts and Folk Art";"2023";"1";"Historic Centre of Bukhara"
"8a01ffff-5a20-4ddb-af63-f82c9fa0e277";"Montreal";"Canada";"north_america";"Charming streets filled with a mix of European elegance and North American vibrancy, offering lively festivals, diverse cuisine, and artistic flair.";"45503182";"-73569806";"Mid-range";"5";"3";"3";"2";"4";"5";"3";"5";"2";"Design";"2006";"0";"None"
"dca139e8-a2d8-4edc-a494-bb831291452e";"Hanoi";"Vietnam";"asia";"Bustling streets filled with the aroma of street food, lively markets, and serene lakes create a vibrant yet peaceful atmosphere.";"21028333";"105854041";"Budget";"5";"3";"3";"1";"3";"5";"3";"4";"2";"Design";"2019";"1";"Central Sector of the Imperial Citadel of Thang Long - Hanoi"
"27867d01-7251-434e-a743-c50193f8dc86";"Perth";"Australia";"oceania";"Sun-kissed beaches meet a laid-back city vibe with sprawling parks, buzzing markets, and a sense of space that feels refreshingly open.";"-31955893";"115860585";"Mid-range";"3";"4";"4";"4";"3";"4";"3";"3";"3";"Crafts and Folk Art";"2021";"0";"None"
"765ff37e-f3fa-48d4-9631-679279fd3045";"Cardiff";"United Kingdom";"europe";"Charming streets lined with historic architecture and lively pubs create a welcoming atmosphere, where you can feel the city's rich cultural heartbeat.";"51481654";"-3179193";"Mid-range";"4";"2";"3";"2";"4";"3";"3";"4";"2";"None";"0";"1";"Blaenavon Industrial Landscape"
"2af06632-f7aa-4f48-88ff-a7f90e8da41e";"San Jose";"United States";"north_america";"A blend of innovation and natural beauty, with sunlit streets, tech-savvy energy, and nearby escapes to lush parks and rolling hills.";"37336166";"-121890591";"Luxury";"3";"3";"4";"2";"3";"3";"3";"4";"2";"None";"0";"0";"None"
"c4d01836-2731-498c-afa0-164e08df33be";"Orlando";"United States";"north_america";"Theme parks brimming with excitement, vibrant entertainment districts, and sunny afternoons create a lively atmosphere perfect for family adventures and fun-filled days.";"28542110";"-81379030";"Mid-range";"3";"4";"3";"2";"4";"3";"3";"4";"2";"None";"0";"0";"None"
"2278b395-3809-4d23-b74d-2e6ebfdce2ed";"Sighisoara";"Romania";"europe";"Cobblestone streets and colorful medieval towers create a fairy-tale setting, inviting you to wander and uncover centuries-old secrets around every corner.";"46220203";"24793448";"Budget";"5";"3";"3";"1";"2";"3";"2";"2";"4";"None";"0";"2";"Villages with Fortified Churches in Transylvania | Historic Centre of Sighişoara"
"31c38956-bfd7-49a1-82f6-656ae066db1f";"Vancouver";"Canada";"north_america";"Nestled between ocean and mountains, this city offers a harmonious blend of urban excitement and serene natural beauty, perfect for outdoor enthusiasts.";"49260872";"-123113952";"Luxury";"4";"4";"5";"3";"4";"4";"4";"5";"3";"None";"0";"0";"None"
"3f80a914-4217-4ee3-87a7-657e5480fea4";"Keswick";"United Kingdom";"europe";"Surrounded by majestic peaks and serene lakes, this charming town offers a peaceful escape with invigorating hikes and quaint local shops.";"54600981";"-3137582";"Mid-range";"3";"4";"5";"2";"2";"3";"3";"2";"4";"None";"0";"1";"The English Lake District"
"43e082aa-865c-4847-a8f3-7ee4e77c05de";"Bologna";"Italy";"europe";"Strolling under ancient porticoes, savoring rich aromas of fresh pasta, and enjoying lively piazzas create a warm, welcoming atmosphere.";"44493820";"11342632";"Mid-range";"5";"2";"3";"1";"3";"5";"3";"4";"2";"Music";"2006";"3";"Ferrara, City of the Renaissance, and its Po Delta | Cathedral, Torre Civica and Piazza Grande, Modena | The Porticoes of Bologna"
"794e7d71-b99b-415f-8b9c-790ec7773bd1";"Isle of Skye";"United Kingdom";"europe";"Dramatic landscapes with rugged cliffs and serene lochs create an enchanting atmosphere, perfect for exploring nature and experiencing tranquil moments.";"57363007";"-6302173";"Mid-range";"3";"4";"5";"3";"1";"3";"3";"1";"5";"None";"0";"0";"None"
"f01a2bac-182f-4a9a-bd44-d75f65b50bd7";"Guimarães";"Portugal";"europe";"Cobblestone streets, medieval architecture, and a welcoming atmosphere make wandering feel like stepping back in time, rich with history and charm.";"41441767";"-8295571";"Mid-range";"4";"3";"3";"1";"2";"4";"3";"3";"3";"None";"0";"1";"Historic Centre of Guimarães and Couros Zone"
"0c2f27fb-d5ed-4047-a16e-05fb872fe7b3";"Macau";"China";"asia";"A unique blend of Portuguese heritage and vibrant Chinese culture, with bustling streets, aromatic food stalls, and dazzling casino lights.";"22175760";"113551414";"Mid-range";"4";"3";"2";"2";"5";"4";"3";"5";"2";"None";"0";"1";"Historic Centre of Macao"
"a42b301e-5afe-417e-a81f-9f847e267f88";"Salento";"Colombia";"south_america";"Rolling green hills and colorful streets create a welcoming vibe, with coffee aromas and vibrant landscapes offering a true sensory escape.";"4637301";"-75569799";"Budget";"4";"4";"5";"1";"2";"4";"3";"2";"4";"None";"0";"1";"Coffee Cultural Landscape of Colombia"
"9f779614-05dd-41e8-833b-8fa44cee9475";"Zagreb";"Croatia";"europe";"A blend of charming cobblestone streets, vibrant markets, and lively cafes creates an inviting atmosphere filled with history and modern culture.";"45813096";"15977279";"Mid-range";"4";"3";"3";"1";"3";"4";"3";"4";"2";"None";"0";"0";"None"
"f206b4f0-81db-4098-8142-a69892f9f14b";"Quito";"Ecuador";"south_america";"Wander through cobblestone streets with vibrant colonial architecture, surrounded by the scent of Andean spices and the hum of lively markets.";"-220164";"-78512327";"Budget";"5";"4";"4";"2";"3";"4";"3";"3";"3";"None";"0";"1";"City of Quito"
"b411a358-6873-46d3-b693-174931a4a948";"San Salvador";"El Salvador";"north_america";"Lively streets buzz with local vendors and colorful markets, while nearby volcanoes and lush landscapes offer a sense of adventure and natural beauty.";"13698993";"-89191424";"Budget";"3";"3";"3";"3";"3";"4";"2";"3";"2";"None";"0";"1";"Joya de Cerén Archaeological Site"
"9cca8483-23d3-4725-b369-ba831d2c16b3";"Suva";"Fiji";"oceania";"Tropical breezes mingle with the vibrant bustle of markets and the warmth of welcoming locals, creating an inviting and lively atmosphere.";"-18141588";"178442166";"Mid-range";"3";"3";"4";"3";"3";"3";"3";"3";"2";"None";"0";"0";"None"
"0eeb9c0f-6cae-4e46-ba5a-dba09017c4ec";"Toulouse";"France";"europe";"Charming cobblestone streets, pink-hued buildings, and a lively café culture create a welcoming atmosphere that's both vibrant and soothing.";"43604462";"1444246";"Mid-range";"4";"3";"3";"2";"4";"4";"3";"4";"2";"Music";"2023";"1";"Canal du Midi"
"9a4f8eec-e269-42bb-96bd-4c0e0a82df57";"Frankfurt";"Germany";"europe";"Skyscrapers and historic charm blend seamlessly, offering a dynamic cityscape where modernity meets tradition, all underlined by a vibrant cultural scene.";"50110644";"8682091";"Mid-range";"4";"2";"3";"1";"4";"4";"3";"5";"2";"None";"0";"2";"Messel Pit Fossil Site | Mathildenhöhe Darmstadt"
"3c3ca961-011a-4144-8dff-741dd64d363e";"Accra";"Ghana";"africa";"Lively streets filled with vibrant markets, rhythmic music, and the aroma of spicy street food create a captivating and energetic atmosphere.";"5557109";"-201237";"Budget";"4";"3";"3";"3";"3";"4";"3";"3";"2";"None";"0";"1";"Forts and Castles, Volta, Greater Accra, Central and Western Regions"
"bfb367bf-51e6-4098-89b3-4868a8b7c834";"Cayenne";"French Guiana";"south_america";"Tropical vibes meet colonial charm with bustling markets, vibrant street life, and lush greenery creating a unique and inviting atmosphere.";"4937154";"-52325873";"Mid-range";"3";"4";"5";"3";"2";"3";"2";"2";"4";"None";"0";"0";"None"
"90ca1550-325d-4036-ae5a-5a2d7518d12a";"Launceston";"Australia";"oceania";"Charming streets lined with heritage buildings, surrounded by lush parks and vineyards, offer a welcoming atmosphere with a touch of rustic elegance.";"-41434081";"147137349";"Mid-range";"3";"4";"5";"2";"2";"3";"3";"3";"4";"Gastronomy";"2021";"0";"None"
"7c9a3427-bce5-49c4-ace2-b19967022373";"Valparaíso";"Chile";"south_america";"Colorful hillside neighborhoods cascade down to the bustling port, where vibrant street art and ocean breezes create an inspiring, bohemian atmosphere.";"-33045845";"-71619674";"Mid-range";"4";"3";"3";"3";"4";"4";"3";"4";"2";"Music";"2019";"1";"Historic Quarter of the Seaport City of Valparaíso"
"265ee9f4-2324-46bc-95e2-11a7b655e833";"Colmar";"France";"europe";"Charming canals lined with half-timbered houses and vibrant flowers create a fairy-tale atmosphere, inviting leisurely strolls and delightful discoveries.";"48077751";"7357964";"Mid-range";"4";"2";"3";"1";"2";"4";"3";"2";"4";"None";"0";"0";"None"
"1e1b5cd7-966e-419c-a2d4-c9fe088a9289";"Bratislava";"Slovakia";"europe";"Charming cobblestone streets and lively squares invite you to explore colorful facades, historic landmarks, and cozy cafés offering a warm, welcoming vibe.";"48151698";"17109306";"Mid-range";"4";"3";"3";"1";"3";"3";"3";"3";"3";"None";"0";"1";"Frontiers of the Roman Empire – The Danube Limes (Western Segment)"
"1d32dfff-864b-4298-8be7-1f9714936244";"Hong Kong";"Hong Kong";"asia";"A bustling metropolis where neon lights reflect off harbor waters, offering a vibrant mix of street markets, towering skyscrapers, and serene parks.";"22279327";"114162813";"Luxury";"5";"3";"3";"2";"5";"5";"3";"5";"2";"None";"0";"0";"None"
"f03bee1f-4a0c-48b7-9552-b0520359357d";"Trinidad";"Cuba";"north_america";"Cobblestone streets echo with the sounds of salsa music, while colorful colonial buildings and vibrant markets create a lively, timeless atmosphere.";"21805205";"-79984579";"Budget";"5";"3";"4";"3";"3";"4";"3";"2";"4";"Crafts and Folk Art";"2019";"1";"Trinidad and the Valley de los Ingenios"
"2112510a-fb29-4ca0-82e1-682dc6073880";"Plovdiv";"Bulgaria";"europe";"Charming cobblestone streets, vibrant street art, and ancient ruins create a unique blend of history and modernity, inviting leisurely exploration.";"42141854";"24749929";"Budget";"4";"3";"3";"1";"3";"4";"3";"3";"3";"None";"0";"0";"None"
"27486037-4990-4ad3-89a3-0d7cf6d3e065";"Maui";"United States";"oceania";"Lush landscapes, vibrant sunsets, and the gentle sound of ocean waves create an inviting and tranquil island atmosphere perfect for unwinding.";"20802956";"-156310683";"Luxury";"3";"4";"5";"5";"3";"4";"4";"2";"4";"None";"0";"0";"None"
"de902972-e11c-42e8-858a-a3bf3cca5af4";"Khiva";"Uzbekistan";"asia";"Wander through ancient, sun-drenched streets surrounded by intricately carved minarets and walls, where history whispers from every corner and time feels suspended.";"41377689";"60362000";"Budget";"5";"2";"3";"1";"2";"3";"2";"2";"4";"None";"0";"1";"Itchan Kala"
"d827d6ed-6c6f-4ab0-b964-26a4defeedef";"Belize City";"Belize";"north_america";"A vibrant mix of Caribbean charm and colonial history, with bustling markets, colorful streets, and the gentle sound of the sea nearby.";"17500276";"-88198873";"Mid-range";"3";"4";"4";"3";"3";"4";"3";"3";"2";"None";"0";"0";"None"
"e570ec15-1d11-49e6-8a55-1243633a8668";"Harare";"Zimbabwe";"africa";"Vibrant streets filled with colorful markets, the scent of blooming jacarandas, and a lively atmosphere make every moment feel uniquely captivating.";"-17856703";"31060158";"Budget";"3";"3";"4";"1";"2";"3";"2";"3";"3";"None";"0";"0";"None"
"60ee6bbb-54f1-495d-b0ce-8f6c4a73f6ab";"Ubud";"Indonesia";"asia";"Lush rice terraces, serene temples, and a vibrant arts scene create a peaceful yet inspiring atmosphere perfect for rejuvenation and exploration.";"-8506897";"115262293";"Budget";"4";"3";"5";"2";"2";"4";"5";"2";"4";"None";"0";"1";"Cultural Landscape of Bali Province: the Subak System as a Manifestation of the Tri Hita Karana Philosophy"
"fae2433c-c914-436c-9b12-c733c2974ac8";"Punta del Este";"Uruguay";"south_america";"Golden beaches meet vibrant nightlife, creating a lively yet laid-back atmosphere where ocean breezes, art, and music fill the air.";"-34963234";"-54943998";"Mid-range";"3";"3";"3";"5";"5";"4";"3";"4";"2";"None";"0";"0";"None"
"9a1ce654-b167-4225-b87a-49d78a91ca0b";"Rapa Nui";"Chile";"south_america";"Mystical landscapes dotted with iconic stone statues create a serene yet awe-inspiring atmosphere, perfect for those seeking a unique cultural experience.";"-27125931";"-109349588";"Luxury";"5";"3";"4";"3";"2";"3";"2";"1";"5";"None";"0";"1";"Rapa Nui National Park"
"6ce8aa84-b119-4e84-aaec-fc4a2471cc9e";"Cork";"Ireland";"europe";"Charming streets lined with colorful shops and lively pubs create a welcoming vibe, while the nearby coast offers stunning natural beauty.";"51898513";"-8472642";"Mid-range";"4";"3";"4";"2";"3";"4";"3";"3";"3";"None";"0";"0";"None"
"b6b694b6-df6b-4aa8-be96-478108285fba";"Batumi";"Georgia";"asia";"A coastal city where lush green mountains meet the Black Sea, offering a blend of modern architecture and charming historic streets.";"41650950";"41636008";"Budget";"3";"3";"4";"4";"3";"4";"3";"3";"2";"Music";"2021";"1";"Colchic Rainforests and Wetlands"
"d0a7fef1-2591-401c-adb2-50b1a432982f";"Vladivostok";"Russia";"asia";"Sweeping ocean views, bustling ports, and a mix of Russian and Asian influences create a dynamic and intriguing atmosphere.";"43115067";"131885576";"Mid-range";"4";"3";"4";"2";"3";"3";"2";"3";"3";"None";"0";"0";"None"
"d908e2d3-b5f2-47d7-9cfc-836e69d13fcb";"Murmansk";"Russia";"asia";"Cold winds sweep across the Arctic landscape, where northern lights dance in the sky and the stark beauty of nature feels otherworldly.";"68970665";"33074970";"Mid-range";"3";"3";"4";"1";"2";"2";"2";"3";"4";"None";"0";"0";"None"
"5e7318b5-3cc9-462e-b9df-7c6f7bec1885";"Moscow";"Russia";"asia";"Grand architecture, vibrant streets, and a rich cultural tapestry create a dynamic atmosphere where history and modern life intertwine seamlessly.";"55625578";"37606391";"Mid-range";"5";"3";"2";"1";"4";"4";"3";"5";"2";"None";"0";"3";"Kremlin and Red Square, Moscow | Church of the Ascension, Kolomenskoye | Ensemble of the Novodevichy Convent"
"4bea1fd4-279e-4e2b-a602-f408dbce9017";"St Petersburg";"Russia";"asia";"Grand palaces and winding canals create an enchanting atmosphere, where every corner reveals rich history and artistic treasures.";"59960673";"30158655";"Mid-range";"5";"2";"3";"1";"4";"4";"3";"5";"2";"None";"0";"1";"Historic Centre of Saint Petersburg and Related Groups of Monuments"
"e10d6c97-8c49-40ca-a97e-231b750532aa";"Caye Caulker";"Belize";"north_america";"Charming sandy streets, vibrant Caribbean colors, and a laid-back vibe invite you to unwind and soak up the island's easygoing atmosphere.";"17739514";"-88033686";"Budget";"3";"4";"4";"4";"3";"4";"3";"2";"4";"None";"0";"0";"None"
